Name,Slug,Collection ID,Locale ID,Item ID,Archived,Draft,Created On,Updated On,Published On,Company Logo,Client Headshot,Author Name,Author Company,Testimonial,Date Started,Location
Dyland Watkins,dyland-watkins,676e84e3b954c7f2994d4b8d,6765aea29edd9107ae8e0af2,67fce18f3613f54d2e269fd4,false,false,Mon Apr 14 2025 10:21:03 GMT+0000 (Coordinated Universal Time),Wed Jun 11 2025 15:50:57 GMT+0000 (Coordinated Universal Time),Wed Jun 11 2025 15:50:57 GMT+0000 (Coordinated Universal Time),,https://cdn.prod.website-files.com/6765aea29edd9107ae8e0b01/67fce14d01921c67913e5950_dylan.avif,Dyland Watkins,DJW Consulting,"<p id="""">Stephen is a top-notch automation expert. He not only knows the latest AI and automation but also is a full stack developer which is incredible as you have work on these advanced projects.</p>",Sat Mar 01 2025 00:00:00 GMT+0000 (Coordinated Universal Time),california
Kotada Yunus,kotada-yunus,676e84e3b954c7f2994d4b8d,6765aea29edd9107ae8e0af2,676e84f86ceaac4d4432a2cb,false,false,Fri Dec 27 2024 10:44:08 GMT+0000 (Coordinated Universal Time),Wed Jun 11 2025 15:50:57 GMT+0000 (Coordinated Universal Time),Wed Jun 11 2025 15:50:57 GMT+0000 (Coordinated Universal Time),https://cdn.prod.website-files.com/6765aea29edd9107ae8e0b01/67a4b8c7874f80b4dd63c115_aktarr-logo.svg,https://cdn.prod.website-files.com/6765aea29edd9107ae8e0b01/67fa4e3861e24d76e75f9b45_kotada.avif,Kotada Yunus,Aktarr,"<p id="""">My team used to spend every waking moment looking for content which meant we couldn't utilise our production studio. Now we have both, great content and we're making full use of our studio space.</p>",Thu Jun 27 2024 00:00:00 GMT+0000 (Coordinated Universal Time),malmo
Liyapa Sikazwe,liyapa-sikazwe,676e84e3b954c7f2994d4b8d,6765aea29edd9107ae8e0af2,676e84f86ceaac4d4432a2c5,false,false,Fri Dec 27 2024 10:44:08 GMT+0000 (Coordinated Universal Time),Wed Jun 11 2025 15:50:57 GMT+0000 (Coordinated Universal Time),Wed Jun 11 2025 15:50:57 GMT+0000 (Coordinated Universal Time),https://cdn.prod.website-files.com/6765aea29edd9107ae8e0b01/67ed49cf5f8cf691300971e6_YELLOW-01-2.avif,https://cdn.prod.website-files.com/6765aea29edd9107ae8e0b01/67fa4eac35fadc68fbce5992_pablo-linkedin.avif,Liyapa Sikazwe,Dose of Venture,"<p id="""">Granite Marketing is both innovative and reliable. Their team took the time to understand our unique challenges and provided a customised solution that integrated with our existing tools, something that we believe hasn't been done before.</p>",Thu Jan 02 2025 00:00:00 GMT+0000 (Coordinated Universal Time),london
Nick Saraev,nick-saraev,676e84e3b954c7f2994d4b8d,6765aea29edd9107ae8e0af2,6814d1e4d7e8a78de24d49ec,false,false,Fri May 02 2025 14:08:36 GMT+0000 (Coordinated Universal Time),Mon Jun 16 2025 15:00:53 GMT+0000 (Coordinated Universal Time),Mon Jun 16 2025 15:19:45 GMT+0000 (Coordinated Universal Time),,https://cdn.prod.website-files.com/6765aea29edd9107ae8e0b01/6814d1dedbfcd1feda5b57de_nick-headshot.avif,Nick Saraev,,"<p id="""">Stephen is a keen &amp; active contributor to Make Money With Make. He consistently shared valuable insights on AI automation/web scraping, and delivered multiple in-depth presentations to our group of over 400 (to great acclaim!). He brings a technical edge to automation that sets him apart from most no/low-code devs. I’d hire him without hesitation.</p>",,canada
Santi Leoni,santi-leoni,676e84e3b954c7f2994d4b8d,6765aea29edd9107ae8e0af2,67fce21b3980840a24c8e1cd,false,false,Mon Apr 14 2025 10:23:23 GMT+0000 (Coordinated Universal Time),Wed Jun 11 2025 15:50:57 GMT+0000 (Coordinated Universal Time),Wed Jun 11 2025 15:50:57 GMT+0000 (Coordinated Universal Time),https://cdn.prod.website-files.com/6765aea29edd9107ae8e0b01/67fce2032492961dd21e4a6a_Pulp-Sense-Logo-_1_-p-500.avif,https://cdn.prod.website-files.com/6765aea29edd9107ae8e0b01/67fce2140652b9c527e4456c_Screenshot%202025-04-14%20at%2011.21.50.avif,Santi Leoni,Pulpe Sense,"<p id="""">Working with Stephen was an exceptionally professional experience. He's highly responsible, structured, and consistently goes out of his way to make sure your project succeeds as intended. His communication is outstanding—even when things get challenging, he keeps you informed at every step. A solid 12/10 experience, I'd confidently recommend him to anyone looking for quality AI work.</p>",Wed Jan 08 2025 00:00:00 GMT+0000 (Coordinated Universal Time),buenos-aires
